date,title,header,medium,country,link
25/04/2023,U.S. Law-Enforcement Agencies Seek to Combat AI Bias,"DOJ, FTC and others focus on how ChatGPT and other tools could be used to discriminate or harm competition",Wall Street Journal,USA,https://www.wsj.com/articles/u-s-law-enforcement-agencies-seek-to-combat-ai-bias-b0d7e763
28/04/2023,Intel Faces a Long Climb Back from the Bottom,"Downtrodden stock jumps on better-than-feared results, but lots of work lies ahead",Wall Street Journal,USA,https://www.wsj.com/articles/intel-faces-a-long-climb-back-from-the-bottom-284d9599
15/02/2023,"Text by Text, Students Sorted Fact From Fiction in MSU Shooting","EAST LANSING, Mich.—Hailee Maynard, a junior at Michigan State University, arrived at the Creole Burger Bar in Lansing Monday evening with six friends—mostly her sorority sisters—excited to celebrate a 22nd birthday.",Wall Street Journal,USA,https://www.wsj.com/articles/text-by-text-students-sorted-fact-from-fiction-in-michigan-state-mass-shooting-23ede883
06/01/2023,New York City Bans ChatGPT in Schools Over Cheating Concerns,Education officials say students could use the artificial-intelligence chatbot to do their schoolwork,Wall Street Journal,USA,https://www.wsj.com/articles/chatgpt-banned-in-new-york-city-public-schools-over-concerns-about-cheating-learning-development-11673024059
19/05/2023,Opinion: Chatbots Will Help Our Species Endure,"Elon Musk, the AI critic, wants to be ready for the death of the sun in five billion years.",Wall Street Journal,USA,https://www.wsj.com/articles/chatbots-will-help-our-species-endure-chat-gpt-ai-algorithm-human-design-search-engine-c31239e
09/03/2023,Baidu Hurries to Ready China’s First ChatGPT Equivalent,Employees work round-the-clock before a planned March 16 rollout,Wall Street Journal,USA,https://www.wsj.com/articles/baidu-scrambles-to-ready-chinas-first-chatgpt-equivalent-ahead-of-launch-bf359ca4
01/09/2023,"U.S. Added 187,000 Jobs Last Month","Employers added 187,000 jobs last month, while wages rose 4.3% from a year earlier",Wall Street Journal,USA,https://www.wsj.com/economy/jobs/jobs-report-august-today-unemployment-economy-de847415
24/08/2023,Russian Court Extends Pretrial Detention of Jailed WSJ Reporter,"Evan Gershkovich, detained on an espionage charge since March, will remain in a Russian jail until at least Nov. 30",Wall Street Journal,USA,https://www.wsj.com/world/russia/russian-court-extends-pretrial-detention-of-jailed-wsj-reporter-6f789219
14/04/2023,"Despite Leak, U.S. and Allies Will Keep Sharing Intelligence","Even after WikiLeaks and Edward Snowden disclosures, Washington enhanced information ties with close partners",Wall Street Journal,USA,https://www.wsj.com/articles/despite-leak-u-s-and-allies-will-keep-sharing-intelligence-f4ba4aa2
29/06/2023,"AI-Powered Tools Are Here to Help—Not Harm—Your Job, Insist IT Experts","Even as code development tools get more sophisticated, thanks to generative AI, vendors and other tech pros say nothing replaces the human touch",Wall Street Journal,USA,https://www.wsj.com/articles/ai-powered-coding-tools-help-harm-your-job-insist-it-experts-33e79767
29/03/2023,Generative AI Is Already Changing White-Collar Work as We Know It,"Executives from Walmart, ZipRecruiter, Yelp and other companies share their thoughts on ChatGPT",Wall Street Journal,USA,https://www.wsj.com/articles/generative-ai-is-already-changing-white-collar-work-as-we-know-it-58b53918
04/04/2023,Expedia Wants ChatGPT to Be Your Travel Adviser,"Expedia is rolling out a new ChatGPT feature in its app, further solidifying the world of travel as one of the first industries to embrace a new wave of artificial-intelligence tools.",Wall Street Journal,USA,https://www.wsj.com/articles/expedia-chatgpt-ai-travel-app-22ffd00
26/07/2023,Meta Takes Some Profitable Social Cues,Facebook parent’s strong results and outlook set a better stage for investment cycle,Wall Street Journal,USA,https://www.wsj.com/articles/meta-takes-some-profitable-social-cues-ca2eb3ae
12/06/2023,Elon Musk’s Twitter vs. Bad Bots: The Battle Goes On,"Fake and spam accounts remain a persistent problem on Twitter, even as new owner Elon Musk has taken steps to stamp them out.",Wall Street Journal,USA,https://www.wsj.com/articles/elon-musks-twitter-vs-bad-bots-the-battle-goes-on-d25ce0ab
11/04/2023,Biden Administration Weighs Possible Rules for AI Tools Like ChatGPT,Fears grow over the potential use of artificial intelligence to commit crimes and spread falsehoods,Wall Street Journal,USA,https://www.wsj.com/articles/biden-administration-weighs-possible-rules-for-ai-tools-like-chatgpt-46f8257b
21/05/2023,iMessage vs. Snapchat: The Battle for Gen Z’s Texts,"For many growing up on social media, texting and Snapchat are synonymous.",Wall Street Journal,USA,https://www.wsj.com/articles/imessage-vs-snapchat-the-battle-for-gen-zs-texts-a31ce69f
30/08/2023,AI Startup Buzz Is Facing a Reality Check,Founders and venture capitalists who flocked to artificial-intelligence startups are learning that turning the chatbot buzz into successful businesses is harder than it seems.,Wall Street Journal,USA,https://www.wsj.com/tech/ai/ai-startup-buzz-is-facing-a-reality-check-e34babfe
13/07/2023,Opinion: Lina Khan’s Artificial Intelligence,"Fresh off its latest legal defeat, the FTC moves to regulate ChatGPT.",Wall Street Journal,USA,https://www.wsj.com/articles/lina-khan-openai-chatgpt-letter-federal-trade-commission-2ac7776f
13/07/2023,ChatGPT Comes Under Investigation by Federal Trade Commission,FTC is examining whether artificial-intelligence app harmed people by publishing false information,Wall Street Journal,USA,https://www.wsj.com/articles/chatgpt-under-investigation-by-ftc-21e4b3ef
07/08/2023,AI Set to Upend the Talent Search at Ad Agencies and Brands,"Generative AI could help recruiters find more diverse and specialized candidates, but job hopefuls are also using it to burnish their CVs",Wall Street Journal,USA,https://www.wsj.com/articles/ai-set-to-upend-the-talent-search-at-ad-agencies-and-brands-cf9df34f
12/06/2023,Nvidia Can Handle Being in the Trillion Dollar Club,"Generative AI demand will persist, while the chip maker’s competitive edge should keep its pricing strong",Wall Street Journal,USA,https://www.wsj.com/articles/nvidia-can-handle-being-in-the-trillion-dollar-club-1ec9e453
24/02/2023,Opinion: ChatGPT Heralds an Intellectual Revolution,Generative artificial intelligence presents a philosophical and practical challenge on a scale not experienced since the start of the Enlightenment.,Wall Street Journal,USA,https://www.wsj.com/articles/chatgpt-heralds-an-intellectual-revolution-enlightenment-artificial-intelligence-homo-technicus-technology-cognition-morality-philosophy-774331c6
01/05/2023,Corporate ChatGPT Applications Grow Despite Legal Scrutiny,"German online fashion retailer Zalando decided not to share customer data to train ChatGPT’s algorithm, privacy chief Jan Wittrodt said",Wall Street Journal,USA,https://www.wsj.com/articles/corporate-chatgpt-applications-grow-despite-legal-scrutiny-991f9a1c
22/08/2023,Microsoft Now Playing the Very Long Game With Activision,"Giving up game streaming is a big concession, but the Xbox maker won’t be shut out of the cloud",Wall Street Journal,USA,https://www.wsj.com/business/media/microsoft-now-playing-the-very-long-game-with-activision-602e55e6
29/08/2023,Former Qualcomm CEO to Lead Company Powering Apple’s Satellite-Text Service,Globalstar also hires other executives from startup founded by Paul Jacobs,Wall Street Journal,USA,https://www.wsj.com/business/telecom/former-qualcomm-ceo-to-lead-company-powering-apples-satellite-text-service-7134d7dc
08/07/2023,"In Battle With Microsoft, Google Bets on Medical AI Program to Crack Healthcare Industry","Google is testing an artificial-intelligence program trained to expertly answer medical questions, racing against rivals including Microsoft to translate recent AI advances into products that would be used widely by clinicians.",Wall Street Journal,USA,https://www.wsj.com/articles/in-battle-with-microsoft-google-bets-on-medical-ai-program-to-crack-healthcare-industry-bb7c2db8
06/04/2023,Google Search to Include Chat AI,"Google plans to add conversational artificial-intelligence features to its flagship search engine, Chief Executive Officer Sundar Pichai said, as it deals with pressure from chatbots such as ChatGPT and wider business issues.",Wall Street Journal,USA,https://www.wsj.com/articles/google-ceo-sundar-pichai-says-search-to-feature-chat-ai-2fa0f54c
04/02/2023,"AI Tech Enables Industrial-Scale Intellectual-Property Theft, Say Critics","Grzegorz Rutkowski has studied the great masters of texture and light—Caravaggio, Rembrandt, Vermeer—and his ability to mimic their techniques has made him an in-demand painter of fantastical beasts and landscapes for the videogame industry.",Wall Street Journal,USA,https://www.wsj.com/articles/ai-chatgpt-dall-e-microsoft-rutkowski-github-artificial-intelligence-11675466857
08/03/2023,"Startup by Former Apple Executives Partners With OpenAI, Microsoft","Humane to launch its first product this spring, with patents suggesting it may be a wearable device",Wall Street Journal,USA,https://www.wsj.com/articles/startup-by-ex-apple-executives-raises-100-million-partners-with-openai-microsoft-4eae0570
22/04/2023,"The Secret History of AI, and a Hint at What’s Next","If you’re worried that artificial intelligence will transform your job, insinuate itself into your daily routines, or lead to wars fought with lethal autonomous systems, you’re a little late—all of those things have already come to pass.",Wall Street Journal,USA,https://www.wsj.com/articles/the-secret-history-of-ai-and-a-hint-at-whats-next-428905de
18/03/2023,The Technology Skills Every Employee Should Have Today,"In today’s workplace, just knowing the basics of Word and Excel won’t cut it anymore.",Wall Street Journal,USA,https://www.wsj.com/articles/technology-skills-employees-should-have-fdc6c0ba
04/06/2023,"Bearish Bets Against S&P 500 Are Surging, Despite Love for Big Tech",Index would be negative for the year without the contribution of seven big tech companies,Wall Street Journal,USA,https://www.wsj.com/articles/bearish-bets-against-s-p-500-are-surging-despite-love-for-big-tech-506cacc
31/01/2023,Mangled Voice-to-Text Messages Are Embarrassing Users,"Instead of typing on a keyboard, Michele Nieves writes social-media posts with her mouth—for better or worse.",Wall Street Journal,USA,https://www.wsj.com/articles/mangled-voice-to-text-message-fails-are-embarrassing-users-11675178572
02/05/2023,"As Generative AI Gets Hotter, KKR Bets on Keeping Data Centers Cool","Investment firm will acquire CoolIT Systems, maker of systems designed to prevent computing hardware from overheating",Wall Street Journal,USA,https://www.wsj.com/articles/as-generative-ai-gets-hotter-kkr-bets-on-keeping-data-centers-cool-d3d62cc7
15/09/2022,Biotech May Be the Next U.S.-China Battleground,Investors in Chinese biotech—and perhaps their U.S. clients too—should be prepared for a rough ride,Wall Street Journal,USA,https://www.wsj.com/articles/biotech-may-be-the-next-u-s-china-battleground-11663231969
02/03/2023,Apple Blocks Update of ChatGPT-Powered App,iPhone maker asks email app with AI-language capabilities to set a 17-and-older age restriction,Wall Street Journal,USA,https://www.wsj.com/articles/apple-blocks-update-of-chatgpt-powered-app-as-concerns-grow-over-ais-potential-harm-c4ca9372
07/07/2023,Companies Are Drowning in Too Much AI,"IT sellers are rolling out an avalanche of new generative AI features, leaving CIOs overwhelmed and workers confused",Wall Street Journal,USA,https://www.wsj.com/articles/companies-are-drowning-in-too-much-ai-1c27c003
26/02/2023,Opinion: How ChatGPT’s AI Will Become Useful,It still needs to go through new versions and have its flaws exposed to be good.,Wall Street Journal,USA,https://www.wsj.com/articles/ais-not-useful-yet-but-it-will-be-chatgpt-artificial-intelligence-robots-microsoft-bing-chatbot-elder-care-tyrell-corporation-self-driving-tesla-technology-a1a27df0
29/06/2023,Are You a Wine Geek?,"It’s a trendy term, but what does true geekery entail? To find out, our wine columnist consulted sommeliers, oenophiles and even an AI chatbot.",Wall Street Journal,USA,https://www.wsj.com/articles/are-you-a-wine-geek-fc7e8222
29/01/2023,DOJ Antitrust Chief Began Confronting Google Years Ago,Jonathan Kanter is a longtime legal adversary to the internet company,Wall Street Journal,USA,https://www.wsj.com/articles/doj-suit-to-break-up-google-was-years-in-the-making-for-antitrust-chief-11675000334
21/05/2023,Opinion: AI’s Education Revolution,Khan Academy is using ChatGPT to bring one-on-one teaching to scale.,Wall Street Journal,USA,https://www.wsj.com/articles/ais-education-revolution-khan-academy-tutor-animation-schools-5aec9a5e
22/06/2023,Consultants Emerge as Early Winners in Generative AI Boom,"Lacking in-house know-how, companies are turning to outside experts for help putting ChatGPT-like tools to work",Wall Street Journal,USA,https://www.wsj.com/articles/consultants-emerge-as-early-winners-in-generative-ai-boom-8df71d38
25/01/2023,Professors Turn to ChatGPT to Teach Students a Lesson,Last month a professor at Weber State University in Utah asked a new artificial-intelligence chatbot to write a tweet in his voice.,Wall Street Journal,USA,https://www.wsj.com/articles/professors-turn-to-chatgpt-to-teach-students-a-lesson-11674657460
12/04/2023,The 25 Questions You Need to Ask Yourself Now That ChatGPT Is Here,"Last year was when artificial intelligence appeared to come into its own, with seemingly magical bots creating images, answering questions, even writing literature.",Wall Street Journal,USA,https://www.wsj.com/tech/ai/ai-questions-to-ask-yourself-e54d7c89
13/07/2023,Google’s Bard AI Chatbot Adds More Languages to Take On ChatGPT,Latest version to also include a privacy hub for all users,Wall Street Journal,USA,https://www.wsj.com/articles/googles-bard-ai-chatbot-adds-more-languages-to-take-on-chatgpt-a2acfc5b
28/09/2022,Business Groups Sue CFPB Over Antidiscrimination Guidelines,Lawsuit marks latest legal battle between industry and Biden regulators,Wall Street Journal,USA,https://www.wsj.com/articles/business-groups-sue-cfpb-over-antidiscrimination-guidelines-11664372702
22/06/2023,Judge Sanctions Lawyers Who Filed Fake ChatGPT Legal Research,Lawyers who sued over alleged airline injury relied on fake cases generated by artificial-intelligence tool,Wall Street Journal,USA,https://www.wsj.com/articles/judge-sanctions-lawyers-who-filed-fake-chatgpt-legal-research-9ebad8f9
29/08/2023,Double Acquisition Highlights How Legal Industry Is Slowly Embracing AI,Legal technology vendor Reveal uses AI and analytics tools to help the legal discovery process,Wall Street Journal,USA,https://www.wsj.com/articles/double-acquisition-highlights-how-legal-industry-is-slowly-embracing-ai-4a1e042c
27/02/2023,When You Bare Your Soul in a Text and the Response Is a Thumbs-Up,Apple’s ’tapback’ messaging response icons don’t all mean the same thing to everyone,Wall Street Journal,USA,https://www.wsj.com/articles/apple-imessage-reactions-confusion-9ecd588
31/05/2023,Stocks Slide With Focus on Potential Rate Hike,Major indexes all close lower as economic concerns linger,Wall Street Journal,USA,https://www.wsj.com/articles/global-stocks-markets-dow-news-05-31-2023-91f8ac0c
27/04/2023,Europe to ChatGPT: Disclose Your Sources,"Makers of artificial-intelligence tools such as ChatGPT would be required to disclose copyright material used in building their systems, according to a new draft of European Union legislation slated to be the West’s first comprehensive set of rules governing the rollout of AI.",Wall Street Journal,USA,https://www.wsj.com/articles/europe-to-chatgpt-disclose-your-sources-863ef330
16/10/2022,"What Will Satellite-Connected Phones Do for Us? Not Much, for Now",New tech in smartphones promises users an ’always connected’ experience. But there are limits.,Wall Street Journal,USA,https://www.wsj.com/articles/satellite-phones-consumers-11665778187
19/03/2023,A Venture Capitalist Imagines What Generative AI Will Change,Martin Casado of Andreessen Horowitz predicts the marginal cost of creating content will be close to zero. But it’s anybody’s guess what that will mean.,Wall Street Journal,USA,https://www.wsj.com/articles/venture-capitalist-martin-casado-what-generative-ai-will-change-c3143190
31/08/2022,"Sorry, I Missed Your Text: Messaging Is the New Email",Me: Coffee next week?,Wall Street Journal,USA,https://www.wsj.com/articles/sorry-i-missed-your-text-messaging-is-the-new-email-11661917283
05/05/2023,Slack’s New CEO Brings Generative AI to the Workplace Conversation,Messaging app hopes new AI features and more integration with Salesforce will resonate with business users,Wall Street Journal,USA,https://www.wsj.com/articles/slacks-new-ceo-brings-generative-ai-to-the-workplace-conversation-af053233
13/06/2023,The Awkward Partnership Leading the AI Boom,"Microsoft and OpenAI’s partnership is one of the hottest tie-ups in tech right now. The relationship has also produced conflict and confusion behind the scenes, according to people familiar with the matter.",Wall Street Journal,USA,https://www.wsj.com/articles/microsoft-and-openai-forge-awkward-partnership-as-techs-new-power-couple-3092de51
08/03/2023,Enterprise Tech Firms Push Further Into Generative AI,Microsoft and Salesforce this week unveiled plans to integrate ChatGPT maker OpenAI’s technology into their business-software apps,Wall Street Journal,USA,https://www.wsj.com/articles/enterprise-tech-firms-push-further-into-generative-ai-7c977e10
28/04/2023,Opinion: Forget AI: The Administrative State Is a Bad Algorithm,Microsoft trustbusters and EPA regulators show chatbots aren’t the only ones who ‘hallucinate.’,Wall Street Journal,USA,https://www.wsj.com/articles/forget-ai-the-administrative-state-is-a-bad-algorithm-microsoft-ftc-ethylene-oxide-chicago-355dc0a4
23/04/2023,Big Tech Depends on AI Shining Through Cloud Haze,"Microsoft, Amazon and Google expected to show another slowdown in cloud growth",Wall Street Journal,USA,https://www.wsj.com/articles/big-tech-depends-on-ai-shining-through-cloud-haze-9640bc92
30/05/2023,"AI Threat Placed on Par With Pandemics, Nuclear War","More than 350 people, including OpenAI and Google executives, sign a statement sounding an alarm about the technology",Wall Street Journal,USA,https://www.wsj.com/articles/ai-threat-is-on-par-with-pandemics-nuclear-war-tech-executives-warn-39105eeb
26/04/2023,PricewaterhouseCoopers to Pour $1 Billion Into Generative AI,"Multiyear investment in U.S. business includes accessing ChatGPT maker OpenAI’s language model, training staff in AI capabilities",Wall Street Journal,USA,https://www.wsj.com/articles/pricewaterhousecoopers-to-pour-1-billion-into-generative-ai-cac2cedd
24/07/2023,Cleaning Up ChatGPT Takes Heavy Toll on Human Workers,"NAIROBI, Kenya—ChatGPT and other new artificial-intelligence chatbots hold the potential to replace humans in jobs ranging from customer-service reps to screenwriters.",Wall Street Journal,USA,https://www.wsj.com/articles/chatgpt-openai-content-abusive-sexually-explicit-harassment-kenya-workers-on-human-workers-cf191483
07/12/2022,How AI That Powers Chatbots and Search Queries Could Discover New Drugs,Natural language processing algorithms like the ones used in Google searches and OpenAI’s ChatGPT promise to slash the time required to bring medications to market,Wall Street Journal,USA,https://www.wsj.com/articles/how-ai-that-powers-chatbots-and-search-queries-could-discover-new-drugs-11670428795
04/06/2023,ETF Providers Rush to Tap Into AI Investing Craze,New actively managed funds give investors broader exposure to artificial intelligence development,Wall Street Journal,USA,https://www.wsj.com/articles/etf-providers-rush-to-tap-into-ai-investing-craze-3ca8e0c2
19/07/2023,Apple’s Next Killer App Is…Voicemail?,New call-screening tools and voice memos mean it’s time once again to speak up,Wall Street Journal,USA,https://www.wsj.com/articles/voicemail-apple-iphone-call-screening-2d2fa77f
25/05/2023,TikTok Is Testing Its Own AI Chatbot Called Tako,"New feature is designed to answer users’ questions, using the kind of AI that powers ChatGPT",Wall Street Journal,USA,https://www.wsj.com/articles/tiktok-is-testing-its-own-ai-chatbot-called-tako-96841d7a
23/06/2023,Directors Approve Contract Deal as Writers’ Strike Continues,New pact was ratified by 87% of Directors Guild of America members,Wall Street Journal,USA,https://www.wsj.com/articles/directors-approve-contract-deal-as-writers-strike-continues-c573d231
28/08/2023,OpenAI Launches Business Version of ChatGPT,New product means the AI startup and its biggest backer are chasing similar clients,Wall Street Journal,USA,https://www.wsj.com/tech/ai/openai-launches-business-version-of-chatgpt-that-competes-with-microsoft-6ea3ff2f
11/04/2023,China Moves to Censor AI,"New rules would hold companies like Alibaba, SenseTime responsible for subversive content produced by their bots",Wall Street Journal,USA,https://www.wsj.com/articles/china-lays-out-strict-rules-for-chatgpt-like-ai-tools-32f70c89
23/02/2023,"Nvidia, Other Chip Companies Race to Cash In on ChatGPT Frenzy",New text-generation tools could add tens of billions of dollars in revenue opportunities,Wall Street Journal,USA,https://www.wsj.com/articles/chip-makers-see-chatgpt-stirring-strong-demand-for-advanced-processors-76f152d1
07/04/2023,Uniqlo’s Parent Company Bets Big on Tiny RFID Chips,"Next-generation self-checkout machines are part of a broader effort to improve the supply chain with radio technology, Fast Retailing CIO Takahiro Tambara says",Wall Street Journal,USA,https://www.wsj.com/articles/uniqlos-parent-company-bets-big-on-tiny-rfid-chips-600b124f
02/02/2023,Opinion: An Automated Andy Kessler?,"No thanks, says this reader.",Wall Street Journal,USA,https://www.wsj.com/articles/chatgpt-ai-automated-andy-kessler-writing-11675288627
12/11/2022,Did a Robot Write This?,"Not this time, but AI is churning out articles, illustrations, fake product reviews and even videos",Wall Street Journal,USA,https://www.wsj.com/articles/can-you-tell-whether-this-headline-was-written-by-a-robot-11668204880
22/01/2023,Opinion: Can ChatGPT Write This Column?,"Not yet, which points to the big question about any technology: Can it scale?",Wall Street Journal,USA,https://www.wsj.com/articles/can-chatgpt-write-this-column-openai-computing-scale-fusion-gene-editing-technology-11674399416
22/08/2023,The Arm IPO Will Test Investors’ AI Conviction,"Now that the artificial-intelligence-driven tech rally has cooled slightly, investors will need to put their money where their mouths are",Wall Street Journal,USA,https://www.wsj.com/tech/ai/arm-ipo-softbank-nasdaq-artificial-intelligence-stocks-8c699371
14/08/2023,What Happens When You Let a Chatbot Plan Your Meals,"Nutritionists advise taking ChatGPT recipes with a grain of salt (and maybe adding a little salt, too)",Wall Street Journal,USA,https://www.wsj.com/tech/ai/chatgpt-artificial-intelligence-recipes-meal-planning-edcd4a71
26/05/2023,"AI Stocks Are Flying, but Don’t Call the Craze a Bubble","Nvidia, other tech stocks have added billions of dollars in market value",Wall Street Journal,USA,https://www.wsj.com/articles/ai-stocks-are-flying-but-dont-call-the-craze-a-bubble-18403c5a
04/08/2023,Amazon Shines During Apple’s Off-Season,"One tech titan snaps its growth slump, while the other remains mired in it",Wall Street Journal,USA,https://www.wsj.com/articles/amazon-shines-during-apples-off-season-7f27fc58
31/01/2023,"ChatGPT Creator Releases Tool to Detect AI-Generated Text, Calls It ‘Unreliable’","OpenAI says tool complements methods educators, employers and others use to determine source of text",Wall Street Journal,USA,https://www.wsj.com/articles/chatgpt-creator-releases-tool-to-detect-ai-generated-text-calls-it-unreliable-11675204820
16/05/2023,What Is ChatGPT? What to Know About the AI Chatbot,OpenAI’s chatbot and Microsoft’s conversational Bing have triggered a new AI race that may reshape the future of work,Wall Street Journal,USA,https://www.wsj.com/articles/chatgpt-ai-chatbot-app-explained-11675865177
30/12/2022,Chatty AI and Protein-Predicting Algorithm Defined the Year in Emerging Tech,OpenAI’s ChatGPT and DeepMind’s AlphaFold AI algorithm hinted at the industry transforming AI-enabled technologies to come,Wall Street Journal,USA,https://www.wsj.com/articles/chatty-ai-and-protein-predicting-algorithm-defined-the-year-in-emerging-tech-11672419460
21/12/2022,ChatGPT Wrote My AP English Essay. I Passed.,"Our columnist went back to high school, this time bringing an AI chatbot to complete her assignments",Wall Street Journal,USA,https://www.wsj.com/articles/chatgpt-wrote-my-ap-english-essayand-i-passed-11671628256
28/04/2023,Opinion: Is Artificial Intelligence Our Forbidden Fruit?,"Peggy Noonan warns us, but we have already tasted the new technology.",Wall Street Journal,USA,https://www.wsj.com/articles/ai-artificial-intelligence-forbidden-fruit-tech-garden-of-eden-20aa3934
21/03/2023,Opinion: Isn’t ChatGPT Redundant?,Poorly researched falsehoods issued with great confidence are hardly a unique offering.,Wall Street Journal,USA,https://www.wsj.com/articles/chat-gpt-false-media-e52b9882
18/05/2023,TikTok Creators Sue Montana Over State’s Ban of Platform,Popular support for TikTok has aided the company before in legal skirmishes in the U.S.,Wall Street Journal,USA,https://www.wsj.com/articles/tiktok-creators-sue-montana-over-states-ban-of-short-video-platform-3a431c18
