date,title,header,medium,country,link
11/07/2023,Amazon Has a Lot of Pumps to Prime,"Prime Day could give retail side a needed boost, but AWS needs a lift as well",Wall Street Journal,USA,https://www.wsj.com/articles/amazon-has-a-lot-of-pumps-to-prime-343765af
31/03/2023,ChatGPT Banned in Italy Over Data-Privacy Concerns,Privacy order comes as regulatory scrutiny over artificial-intelligence tools grows,Wall Street Journal,USA,https://www.wsj.com/articles/chatgpt-banned-in-italy-over-data-privacy-concerns-4b984e75
21/03/2023,Generative AI Makes Headway in Healthcare,"Providers are tapping ChatGPT technology to summarize patient visits, assist in research",Wall Street Journal,USA,https://www.wsj.com/articles/generative-ai-makes-headway-in-healthcare-cb5d4ee2
27/03/2023,Salesforce’s Benioff Lives to Deal Another Day,"Quelling a proxy challenge buys the cloud-software pioneer time, but pressure to juice its bottom line won’t abate",Wall Street Journal,USA,https://www.wsj.com/articles/salesforces-marc-benioff-lives-to-deal-another-day-4d57de3a
10/08/2023,AI Is Generating Security Risks Faster Than Companies Can Keep Up,Rapid growth of generative AI-based software is challenging business technology leaders to keep potential cybersecurity issues in check,Wall Street Journal,USA,https://www.wsj.com/articles/ai-is-generating-security-risks-faster-than-companies-can-keep-up-a2bdedd4
19/06/2023,"As AI Expands, Consumers Will Still Prefer Some Products Made With a Human Touch",Research suggests how companies can promote their products to tap into people’s desire for uniqueness,Wall Street Journal,USA,https://www.wsj.com/articles/ai-products-marketing-human-made-14a1f7e1
25/04/2023,Google Is All About Cost Control Now,Revenue growth remains sluggish while cost shuffling shines the cloud business’s bottom line,Wall Street Journal,USA,https://www.wsj.com/articles/google-is-all-about-cost-control-now-ab6651a9
28/04/2023,Opinion: Artificial Intelligence Needs Guardrails and Global Cooperation,"Risks abound when the internet becomes a playpen for thousands, perhaps millions, of artificial intelligence systems.",Wall Street Journal,USA,https://www.wsj.com/articles/ai-needs-guardrails-and-global-cooperation-chatbot-megasystem-intelligence-f7be3a3c
10/02/2023,"China’s Baidu Developing Its Own ChatGPT, Joining Global AI Race",Search giant plans to release chatbot powered by artificial intelligence and integrate it into its engine,Wall Street Journal,USA,https://www.wsj.com/articles/baidu-is-developing-its-own-chatgpt-aiming-to-integrate-it-into-search-11675065601
24/03/2023,Google Made the Bard AI Chatbot Boring. On Purpose.,Search giant’s competitor to ChatGPT and Bing is more reserved—and that’s not a bad thing,Wall Street Journal,USA,https://www.wsj.com/articles/google-made-the-bard-ai-chatbot-boring-on-purpose-ab28ae40
04/02/2023,Don’t Be the Parent Who Ghostwrites the Kids’ Texts,"Seeing a child endure drama over group chats is enough to send parents lunging for their kid’s phone. After all, we have the skills to resolve disputes diplomatically, the words to make it all better. If only we could just…",Wall Street Journal,USA,https://www.wsj.com/articles/dont-be-the-parent-who-ghostwrites-the-kids-texts-yes-this-is-a-thing-11675450008
09/03/2023,Don’t Trust an AI Chatbot With All Your Travel Plans Just Yet,Should you trust a bot to plan your next vacation?,Wall Street Journal,USA,https://www.wsj.com/articles/ai-chat-gpt-bing-travel-flights-hotels-b717148e
06/10/2022,TikTok Parent ByteDance Sees Losses Swell in Push for Growth,Social-media giant saw its operating losses more than triple last year to above $7 billion,Wall Street Journal,USA,https://www.wsj.com/business/tiktok-parent-bytedance-sees-losses-swell-in-push-for-growth-11665071238
17/02/2023,Microsoft Defends New Bing After AI Chatbot Offers Unhinged Responses,Software company addresses concerns about search engine powered by the technology behind ChatGPT,Wall Street Journal,USA,https://www.wsj.com/tech/ai/microsoft-defends-new-bing-says-ai-upgrade-is-work-in-progress-3447074d
10/02/2023,Microsoft Adds ChatGPT AI Technology to Bing Search Engine,Software company aims to capitalize on OpenAI investment,Wall Street Journal,USA,https://www.wsj.com/tech/ai/microsoft-adds-chatgpt-ai-technology-to-bing-search-engine-11675793525
16/03/2023,Microsoft Adds the Tech Behind ChatGPT to Its Business Software,"Software company announces an AI upgrade for Word, Excel, PowerPoint, Outlook and Teams",Wall Street Journal,USA,https://www.wsj.com/articles/microsoft-blends-the-tech-behind-chatgpt-into-its-business-software-c79f0e8d
19/07/2023,Microsoft Shows AI Won’t Be a Loss Leader,Software company’s pricing of Copilot AI tool is well above projections,Wall Street Journal,USA,https://www.wsj.com/articles/microsoft-shows-ai-wont-be-a-loss-leader-55949157
26/04/2023,Microsoft Revenue Growth Stays Low as Economic Concerns Hurt Demand,Software firm’s cloud-computing business decelerates as companies become more cautious about spending,Wall Street Journal,USA,https://www.wsj.com/articles/microsoft-msft-q3-earnings-report-2023-66390b7c
17/02/2023,Microsoft Caps New Bing Usage After AI Chatbot Offered Unhinged Responses,Software giant seeks to address concerns about search engine powered by the technology behind ChatGPT,Wall Street Journal,USA,https://www.wsj.com/articles/microsoft-puts-caps-on-new-bing-usage-after-ai-chatbot-offered-unhinged-responses-39c3252f
23/01/2023,Microsoft to Invest Billions in ChatGPT Creator,Software giant to expand use of artificial intelligence in its products,Wall Street Journal,USA,https://www.wsj.com/articles/microsoft-says-it-plans-multibillion-dollar-investment-in-openai-11674483180
09/01/2023,Opinion: Will AI Make Creative Workers Redundant?,Software has turned human language translators into editors. ChatGPT and other programs may do something similar to writers and other artists.,Wall Street Journal,USA,https://www.wsj.com/articles/will-ai-make-creative-workers-redundant-machine-learning-artificial-intelligence-technology-human-art-11673303015
26/12/2022,TikTok Security Dilemma Revives Push for U.S. Control,Some Biden administration officials think TikTok will remain security risk as long as it is owned by Chinese company,Wall Street Journal,USA,https://www.wsj.com/articles/tiktok-security-dilemma-revives-push-for-u-s-control-11672064033
24/01/2023,Companies Tap Tech Behind ChatGPT to Make Customer-Service Chatbots Smarter,"Some businesses are figuring out how to harness the buzzy technology to improve online chat functions, though executives are wary of AI’s tendency to get things wrong",Wall Street Journal,USA,https://www.wsj.com/articles/companies-tap-tech-behind-chatgpt-to-make-customer-service-chatbots-smarter-11674509622
30/05/2023,"To Work Fewer Hours, They Put AI on the Job",Some say generative artificial intelligence will transform the workforce. Many workers say it already has.,Wall Street Journal,USA,https://www.wsj.com/articles/using-ai-shorten-work-day-b7e7126f
21/06/2023,AI Hype Lifts Adobe Above Deal Cloud,"Stock has surged since generative AI announcement, while scrutiny of Figma deal grows",Wall Street Journal,USA,https://www.wsj.com/articles/ai-hype-lifts-adobe-above-deal-cloud-894b8658
30/06/2023,Apple at $3 Trillion Is a Vision Quest,"Stock’s big run comes ahead of expected sales slowdown, reflecting hype over next big thing",Wall Street Journal,USA,https://www.wsj.com/articles/apple-at-3-trillion-is-a-vision-quest-96fa7400
13/05/2023,Do You Hate to Write? These Tech Tools May Help,Stop relying just on Microsoft Word and Google Docs. Other tools can make your writing easier and better.,Wall Street Journal,USA,https://www.wsj.com/articles/writing-tech-tools-help-cd762aec
25/04/2023,Opinion: Artificial Intelligence and the Future of Employment,Students discuss the impact of AI and machine learning for jobs and education.,Wall Street Journal,USA,https://www.wsj.com/articles/artificial-intelligence-and-the-future-of-employment-college-students-education-jobs-ai-d4470007
02/05/2023,Chegg Stock Cut in Half After Warning ChatGPT Is Hurting Growth,Study-materials provider sees an increase in student interest in generative AI,Wall Street Journal,USA,https://www.wsj.com/articles/chegg-stock-nearly-cut-in-half-after-warning-that-chatgpt-is-hurting-growth-98a172cc
24/03/2023,Loophole Allows U.S. Tech Exports to Banned Chinese Firms,"Suppliers can sell to unlisted subsidiaries of companies on Commerce Department list, officials say",Wall Street Journal,USA,https://www.wsj.com/articles/loophole-allows-u-s-tech-exports-to-banned-chinese-firms-b4800164
15/02/2023,Can ChatGPT Recommend Movies? A Film Buff Put It to the Test,"Sure, the AI chatbot can write an essay about Chaucer. We wanted to see whether it had any taste in films.",Wall Street Journal,USA,https://www.wsj.com/articles/can-chatgpt-recommend-movies-a-film-buff-put-it-to-the-test-5e7e6516
29/03/2023,Generative AI Tools Use Custom Data to Power More Business Functions,"Tapping industry-specific data in areas such as financial management or marketing provides an edge in a crowded AI market, analysts say",Wall Street Journal,USA,https://www.wsj.com/articles/generative-ai-tools-use-custom-data-to-power-more-business-functions-2f158dbb
21/07/2023,"White House Says Amazon, Google, Meta, Microsoft Agree to AI Safeguards","Tech companies adopt voluntary guidelines, such as watermarking artificial content",Wall Street Journal,USA,https://www.wsj.com/articles/white-house-says-amazon-google-meta-microsoft-agree-to-ai-safeguards-eabe3680
12/07/2023,"Elon Musk Launches xAI, His New Artificial-Intelligence Company",Tech companies are racing to develop alternatives to ChatGPT,Wall Street Journal,USA,https://www.wsj.com/articles/elon-musk-xai-artificial-intelligence-company-openai-chatgpt-4a6f178a
27/01/2023,Google Tries to Catch Up to Rivals Like  OpenAI as They Release Viral Apps,Tech giant’s invention led to recent breakthroughs in AI chatbots and image programs now being popularized by competitors,Wall Street Journal,USA,https://www.wsj.com/articles/google-tries-to-catch-up-to-rivals-like-openai-as-they-release-viral-apps-11674828418
03/03/2023,Apple Approves ChatGPT-Powered App After Assurance of Content Moderation,Tech giant’s review of email app comes as concerns grow over AI’s potential harm,Wall Street Journal,USA,https://www.wsj.com/articles/apple-approves-chatgpt-powered-app-after-assurance-of-content-moderation-9c82cd7
15/05/2023,AI Spending Will Cloud Chip Slowdown,Tech giants need pricey chips from suppliers such as Nvidia while also watching their costs,Wall Street Journal,USA,https://www.wsj.com/articles/ai-spending-will-cloud-chip-slowdown-1dbf261d
10/02/2023,GE’s Finance Chief Sees Future for AI Across Company’s Business,"Technologies like ChatGPT might find a spot on the shop floor as automation increases, says Carolina Dybeck Happe",Wall Street Journal,USA,https://www.wsj.com/articles/ges-finance-chief-sees-future-for-ai-across-companys-business-11675889833
11/05/2023,Will AI Help Us or Leave Us Behind?,"Technology revolutions usually start with little fanfare. No one woke up one morning in 1760 and shouted, “OMG, the Industrial Revolution has just begun!” Even the Digital Revolution chugged away for many years in the background, with hobbyists cobbling together personal computers to show off at geeky gatherings such as the Homebrew Computer Club, before people noticed that the world was being fundamentally transformed.",Wall Street Journal,USA,https://www.wsj.com/articles/will-ai-help-us-or-leave-us-behind-a1dfa5d3
27/03/2023,Russia Supplies Iran With Cyber Weapons as Military Cooperation Grows,Tehran is receiving advanced surveillance software after providing drones for Ukraine battlefield,Wall Street Journal,USA,https://www.wsj.com/articles/russia-supplies-iran-with-cyber-weapons-as-military-cooperation-grows-b14b94cd
01/08/2023,Artificial Intelligence Is Creating Ethical Dilemmas. How Would You Solve Them?,Tell us what you think about some of the thorniest questions that ChatGPT raises,Wall Street Journal,USA,https://www.wsj.com/arts-culture/books/artificial-intelligence-is-creating-ethical-dilemmas-how-would-you-solve-them-1cf22dc7
05/01/2023,ChatGPT Creator Is Talking to Investors About Selling Shares at $29 Billion Valuation,Tender offer at that valuation would make OpenAI one of the most valuable U.S. startups,Wall Street Journal,USA,https://www.wsj.com/articles/chatgpt-creator-openai-is-in-talks-for-tender-offer-that-would-value-it-at-29-billion-11672949279
21/02/2023,​Microsoft Gets an Early Taste of Search’s Dark Side,Test drives of ChatGPT-powered Bing search engine reveal shortcomings—and likely will cool threat to Google’s position,Wall Street Journal,USA,https://www.wsj.com/articles/microsoft-gets-an-early-taste-of-searchs-dark-side-13eff42b
12/04/2023,ChatGPT Can Give Great Answers. But Only if You Know How to Ask the Right Question.,That’s why companies are hiring ‘prompt engineers’—experts in talking to AI systems effectively,Wall Street Journal,USA,https://www.wsj.com/articles/chatgpt-ask-the-right-question-12d0f035
03/01/2023,Opinion: How Do Students Feel About OpenAI’s ChatGPT?,The artificial-intelligence chatbot has surprised users with its ability to write colloquial responses.,Wall Street Journal,USA,https://www.wsj.com/articles/how-do-students-feel-about-openais-chatgpt-education-openai-exams-testing-essay-learning-plagiarism-cheating-11672780587
19/06/2023,"Artificial Intelligence May Eliminate Some Jobs, OpenAI Executive Says","The ChatGPT developer, like other AI innovators, has sought to walk a fine line on the impact of the technology on jobs",Wall Street Journal,USA,https://www.wsj.com/articles/artificial-intelligence-may-eliminate-some-jobs-openai-executive-says-d4ccd285
25/02/2023,"With AI, We Are All Once Again Tech Companies’ Guinea Pigs",The companies touting new chat-based artificial-intelligence systems are running a massive experiment—and we are the test subjects.,Wall Street Journal,USA,https://www.wsj.com/articles/chat-gpt-open-ai-we-are-tech-guinea-pigs-647d827b
16/02/2023,GE HealthCare Makes Push Into Artificial Intelligence,The company is developing a software platform that helps hospitals guide care,Wall Street Journal,USA,https://www.wsj.com/articles/ge-healthcare-makes-push-into-artificial-intelligence-136cb509
18/04/2023,"Muse Tax, Built on OpenAI’s GPT, Targets Tax Codes",The company is one of many across a range of industries that are starting to figure out how to make use of fast-breaking developments in AI,Wall Street Journal,USA,https://www.wsj.com/articles/muse-tax-built-on-openais-gpt-targets-tax-codes-32ebd1e4
10/02/2023,OpenAI to Offer ChatGPT Subscription Plan for $20 a Month,The company plans to continue offering a free version of the chatbot,Wall Street Journal,USA,https://www.wsj.com/articles/openai-to-offer-chatgpt-monthly-subscription-plan-11675284555
16/03/2023,Five Things Marketers Should Know About Generative AI in Advertising,"The creative industry is slowly beginning to use the technology, captivated by its ability to spin out ideas and mop up drudge work, but leery of its sporadically kooky output",Wall Street Journal,USA,https://www.wsj.com/articles/five-things-marketers-should-know-about-generative-ai-in-advertising-5381c1d0
26/06/2023,Databricks Strikes $1.3 Billion Deal for Generative AI Startup MosaicML,"The deal aims at connecting businesses’ data with services to help them build their own, cheaper language models, Databricks CEO says",Wall Street Journal,USA,https://www.wsj.com/articles/databricks-strikes-1-3-billion-deal-for-generative-ai-startup-mosaicml-fdcefc06
12/07/2023,Havas Takes Majority Stake in Creative Agency Uncommon,The deal represents a bet that top marketing creative talent can outperform AI,Wall Street Journal,USA,https://www.wsj.com/articles/havas-takes-majority-stake-in-creative-agency-uncommon-b301aca1
11/08/2023,AI Mania Triggers Dot-Com Bubble Flashbacks,"The dot-com bubble taught investors to be wary of stock-market rallies powered by a technological boom—that is, until generative artificial intelligence sent tech stocks soaring this year.",Wall Street Journal,USA,https://www.wsj.com/articles/artificial-intelligence-stocks-dot-com-bubble-fears-7848d402
27/02/2023,"In the Whirl of ChatGPT, Startups See an Opening for Their AI Chips","The fascination with generative AI has spring-loaded demand for products that can help deliver on its promise. And startups are primed to pounce. ‘There’s new openings for attack,’ says one venture capitalist",Wall Street Journal,USA,https://www.wsj.com/articles/in-the-whirl-of-chatgpt-startups-see-an-opening-for-their-ai-chips-cb74798f
09/05/2023,"Wendy’s, Google Train Next-Generation Order Taker: an AI Chatbot",The fast-food chain has customized a language model with terms like ‘JBC’ for junior bacon cheeseburger and ‘biggie bags’ for meal combos,Wall Street Journal,USA,https://www.wsj.com/articles/wendys-google-train-next-generation-order-taker-an-ai-chatbot-968ff865
20/07/2023,Opinion: If Lina Khan Had Been Around When the Typewriter Was Invented,The FTC is all over ChatGPT.,Wall Street Journal,USA,https://www.wsj.com/articles/lina-khan-ftc-chatgpt-typewriter-fdbbb530
04/05/2023,The Boss Has a Way With Words—or Is It AI?,"The heartfelt email, that clever turn of phrase, those pithy bullet points in the slide deck—did they come from the boss, or a bot?",Wall Street Journal,USA,https://www.wsj.com/articles/the-bosss-intelligence-might-be-artificial-d9361555
02/08/2023,Home Depot’s Chief Information Officer on the Role of Tech Postpandemic,The home-improvement retailer aims to increase and better serve its professional customers amid a pullback in consumer DIY projects,Wall Street Journal,USA,https://www.wsj.com/articles/home-depots-chief-information-officer-on-the-role-of-tech-after-pandemic-sales-boost-7903783d
20/10/2022,Microsoft in Advanced Talks to Increase Investment in OpenAI,The investment interest indicates the big bets tech giants are willing to make in artificial-intelligence technology,Wall Street Journal,USA,https://www.wsj.com/articles/microsoft-in-advanced-talks-to-increase-investment-in-openai-11666299548
18/05/2023,"Apple Restricts Employee Use of ChatGPT, Wary of Leaks",The iPhone maker is concerned workers could release confidential data as it develops its own similar technology,Wall Street Journal,USA,https://www.wsj.com/articles/apple-restricts-use-of-chatgpt-joining-other-companies-wary-of-leaks-d44d7d34
04/05/2023,Apple Finds Strength in India as Overall Sales Fall for Second Straight Quarter,The iPhone-maker says sales in India and other countries helped offset waning demand for Macs and iPads,Wall Street Journal,USA,https://www.wsj.com/articles/apple-aapl-q2-earnings-report-2023-25ab6709
02/03/2023,AI Has Its ‘iPhone Moment’,The launch of ChatGPT has set off a frenzy by companies to show they are in the AI game,Wall Street Journal,USA,https://www.wsj.com/articles/ai-has-its-iphone-moment-d9b47f4e
01/03/2023,"Instacart Joins ChatGPT Frenzy, Adding Chatbot To Grocery Shopping App","The move comes as ChatGPT maker OpenAI eases the process of integrating its generative artificial intelligence software with outside apps, company co-founder says",Wall Street Journal,USA,https://www.wsj.com/articles/instacart-joins-chatgpt-frenzy-adding-chatbot-to-grocery-shopping-app-bc8a2d3c
13/04/2023,"In Sales, People Are Beating the Chatbots","The Nanit baby monitor uses a high-tech camera and software to track an infant’s sleep habits. It is like a $249 AI parent who stays up all night logging rollovers and breathing patterns, and doesn’t need coffee the next morning.",Wall Street Journal,USA,https://www.wsj.com/articles/artificial-intelligence-sales-jobs-workers-127289f3
29/06/2023,Wall Street Regulators’ New Target: Emojis,The new focus on texting and emojis comes as regulators push financial institutions to better monitor and retain business communications,Wall Street Journal,USA,https://www.wsj.com/articles/emojis-wall-street-regulators-finance-finra-5bbf5688
28/08/2023,Generative AI Promises an Economic Revolution. Managing the Disruption Will Be Crucial.,"The potential macroeconomic benefits of generative artificial intelligence and machine-learning technologies are staggering, on par with transformative technologies that fed the industrial revolution or the information age. Generative AI, by some estimates, stands to double the rate of U.S. productivity growth after a decade of widespread adoption and add trillions of dollars a year to global economic output.",Wall Street Journal,USA,https://www.wsj.com/articles/generative-ai-promises-an-economic-revolution-managing-the-disruption-will-be-crucial-b1c0f054
09/05/2023,ChatGPT Is Causing a Stock-Market Ruckus,The rise of artificial intelligence is taking the tech world by storm. The technology is also making waves on Wall Street.,Wall Street Journal,USA,https://www.wsj.com/articles/chatgpt-is-causing-a-stock-market-ruckus-4b7cc008
28/07/2023,Emmy Awards Postponed Amid Writers’ and Actors’ Strikes,"The show honoring achievements in television typically kicks off the fall season in Hollywood. But without presenters or joke writers, organizers faced the prospect of a nonevent.",Wall Street Journal,USA,https://www.wsj.com/articles/emmy-awards-postponed-strike-writers-actors-2188f0e7
19/06/2023,Omnicom Group to Debut Tool Using Generative AI for Advertising Employees,"The tool, which uses Microsoft technology, can help build media plans and target ad audiences, among other tasks",Wall Street Journal,USA,https://www.wsj.com/articles/omnicom-group-to-debut-tool-using-generative-ai-for-advertising-employees-4976424
13/02/2023,What to Do About a Boss Who’s Pinging You at All Hours,There are ways to conquer the torrent of round-the-clock messages,Wall Street Journal,USA,https://www.wsj.com/articles/what-to-do-about-a-boss-whos-pinging-youat-allhours-35b2f928
24/01/2023,Opinion: ChatGPT at the Supreme Court?,Try explaining an AI-related error to the justices.,Wall Street Journal,USA,https://www.wsj.com/articles/chatgpt-ai-at-supreme-court-lawyer-11674539095
06/09/2022,Ukraine War Deepens International Cyber-Defense Cooperation,U.S.-led efforts to secure Ukraine’s cyber defenses have fueled interest in broader collaboration to thwart cyberattacks,Wall Street Journal,USA,https://www.wsj.com/articles/russias-war-on-ukraine-deepens-international-cyber-defense-cooperation-11662436289
11/04/2023,A Guide to Collaborating With ChatGPT for Work,"Unlike with other tech tools, working with generative AI is closer to collaborating with humans",Wall Street Journal,USA,https://www.wsj.com/articles/how-use-chatgpt-work-fe337d4e
25/08/2023,"Eyeing an Electric Vehicle Boom, Venture Investors Back Mining Startups","Venture capitalists are investing in biochemical, robotics and hard-tech companies focused on finding and extracting precious materials",Wall Street Journal,USA,https://www.wsj.com/articles/eyeing-an-electric-vehicle-boom-venture-investors-back-mining-startups-df3c92a7
22/02/2023,JPMorgan Restricts Employees From Using ChatGPT,Verizon and other organizations have also blocked access to the popular AI chatbot,Wall Street Journal,USA,https://www.wsj.com/articles/jpmorgan-restricts-employees-from-using-chatgpt-2da5dc34
17/04/2023,How AI Is Building the Next Blockbuster Videogames,"Videogame companies say the kind of technology behind the viral chatbot ChatGPT is set to radically speed up game development, reduce costs and help players interact with characters in new ways.",Wall Street Journal,USA,https://www.wsj.com/articles/how-ai-is-building-the-next-blockbuster-videogames-6fefdd1c
14/07/2023,Hollywood Actors Join Writers on Strike,Walkout began Friday as Screen Actors Guild ends negotiations over new contract with studios,Wall Street Journal,USA,https://www.wsj.com/articles/hollywood-actors-set-to-join-writers-on-strike-after-contract-expires-d86e7f30
02/08/2023,AMD Keeps the AI Dream Alive Enough,Wall Street stays positive on chip maker ahead of major AI chip launch late this year,Wall Street Journal,USA,https://www.wsj.com/articles/amd-keeps-the-ai-dream-alive-enough-36f95a84
30/06/2023,What Will AI Do to Your Job? Take a Look at What It’s Already Doing to Coders,Want to know if artificial intelligence is going to eliminate millions of jobs? The first place to look is the industry that birthed the technology.,Wall Street Journal,USA,https://www.wsj.com/articles/ai-jobs-replace-tech-workers-8f3dc92
27/04/2023,Amazon’s Cloud Casts a Shadow,Warning about AWS slowdown offsets improved retail results and earnings jump,Wall Street Journal,USA,https://www.wsj.com/articles/amazons-cloud-casts-a-shadow-15786d43
01/06/2023,How ChatGPT Can Help Children Learn,"We have all heard the catastrophizing: In a world of artificial intelligence, educational standards will collapse. Students will no longer have to do research, write essays or even think critically. ChatGPT will do it all for them.",Wall Street Journal,USA,https://www.wsj.com/articles/two-cheers-for-chatgpt-in-the-classroom-e124195c
06/03/2023,"Opinion: As AI Conquers Knowledge, We Need to Lean on Wisdom",We have no idea if ChatGPT and the rest will make matters better or worse.,Wall Street Journal,USA,https://www.wsj.com/articles/ai-humans-intelligence-chatgpt-kissinger-cb26ab07
