date,title,header,medium,country,link
23/06/2023,Opinion: Pivot to the Pacific? That Misses the Point,We need a rebuilt defense industrial base to make our forces ready for combat in any theater.,Wall Street Journal,USA,https://www.wsj.com/articles/pivot-to-the-pacific-that-misses-the-point-military-army-weapons-backlog-1478899d
06/06/2023,Opinion: Apple Reveals the Metaverse,"When it arrives, you will be interacting with AIs rather than with real people through your Vision Pro.",Wall Street Journal,USA,https://www.wsj.com/articles/apple-reveals-the-metaverse-chatbot-virtual-reality-headset-artificial-intelligence-e7304cba
12/07/2023,AI Junk Is Starting to Pollute the Internet,"When she first heard of the humanlike language skills of the artificial-intelligence bot ChatGPT, Jennifer Stevens wondered what it would mean for the retirement magazine she edits.",Wall Street Journal,USA,https://www.wsj.com/articles/chatgpt-already-floods-some-corners-of-the-internet-with-spam-its-just-the-beginning-9c86ea25
13/05/2023,Help! My Political Beliefs Were Altered by a Chatbot!,"When we ask ChatGPT or another bot to draft a memo, email, or presentation, we think these artificial-intelligence assistants are doing our bidding. A growing body of research shows that they also can change our thinking—without our knowing.",Wall Street Journal,USA,https://www.wsj.com/articles/chatgpt-bard-bing-ai-political-beliefs-151a0fe4
12/04/2023,"AI Can Write a Song, but It Can’t Beat the Market",Where is Wall Street’s AI revolution?,Wall Street Journal,USA,https://www.wsj.com/articles/ai-can-write-a-song-but-it-cant-beat-the-market-6df50efd
23/05/2023,Biden Administration Developing National AI Strategy,White House seeks public input on rules for AI tools like ChatGPT,Wall Street Journal,USA,https://www.wsj.com/articles/biden-administration-developing-national-ai-strategy-ee22b44e
28/03/2023,"Too Much U.S. Government Information Is Classified, Report Finds","White House, Congress seek solution to problem that has long bedeviled U.S. government",Wall Street Journal,USA,https://www.wsj.com/articles/overclassification-problems-widespread-in-federal-government-report-finds-7fb98342
07/12/2022,ChatGPT and Lensa: Why Everyone Is Playing With Artificial Intelligence,Who knew artificial intelligence could be so entertaining?,Wall Street Journal,USA,https://www.wsj.com/articles/everyone-in-your-feed-is-talking-about-chatgpt-and-lensa-and-heres-why-11670356499
12/02/2023,Opinion: This Is One Puzzling Job Market,Why has productivity lagged for so long? Because huge sectors shunned technology.,Wall Street Journal,USA,https://www.wsj.com/articles/one-puzzling-job-market-employment-unemployment-productivity-tech-layoffs-help-wanted-technology-automation-robots-ai-chatgpt-70d9e54
24/01/2023,Opinion: Mike Pence’s Classified Documents,Will 2024 contenders who don’t have secret materials raise a hand?,Wall Street Journal,USA,https://www.wsj.com/articles/mike-pence-classified-documents-joe-biden-donald-trump-fbi-merrick-garland-11674596342
03/06/2023,How to Be Smart About Artificial-Intelligence ETFs,"With all the attention on ChatGPT, investors are looking for ways to cash in on the hot tech trend",Wall Street Journal,USA,https://www.wsj.com/articles/investors-flock-etfs-focused-ai-artificial-intelligence-33676b0
10/02/2023,"TripActions Rebrands as Navan, Adds ChatGPT to Expense Reports","With the reset, the business-travel software startup is taking on market leader Concur with new tools, CEO says",Wall Street Journal,USA,https://www.wsj.com/articles/tripactions-rebrands-as-navan-adds-chatgpt-to-expense-reports-11675740210
30/07/2023,Opinion: AI’s Growing Legal Troubles,"Without Section 230 protection, copyright issues and defamation suits are cropping up.",Wall Street Journal,USA,https://www.wsj.com/articles/ais-growing-legal-troubles-section-230-publisher-class-action-9efaf374
27/07/2023,Little-Known Tips for Working Smarter With Your Office Software,"You may think you know all there is to know about Microsoft Word, Google Docs, Excel, PowerPoint, Gmail, Outlook and other apps. But you probably don’t.",Wall Street Journal,USA,https://www.wsj.com/lifestyle/workplace/office-software-microsoft-google-docs-tips-649783f0
08/06/2023,Meta Reveals Twitter Competitor Planned as Stand-Alone App,"Zuckerberg criticizes Apple’s Vision Pro headset, saying Meta has tried to make products affordable",Wall Street Journal,USA,https://www.wsj.com/articles/meta-reveals-twitter-competitor-it-plans-to-launch-as-stand-alone-app-4a9b7721
09/08/2023,Clarivate Launches Enhanced Search Powered by Generative Artificial Intelligence,Latest iteration of patent pending platform enables life sciences and pharmaceutical companies to access insights from billions of proprietary data points,Wall Street Journal,USA,https://www.wsj.com/articles/clarivate-launches-enhanced-search-powered-by-generative-artificial-intelligence-bd86fc27
29/08/2023,Trending: Google Cloud Enters Multiple AI Partnerships,Google is selling access to its artificial-intelligence technology and entering several partnerships to bring that technology to additional consumers.,Wall Street Journal,USA,https://www.wsj.com/articles/trending-google-cloud-enters-multiple-ai-partnerships-f90d5dfc
27/07/2023,Tech Down as Meta Bounce Fades -- Tech Roundup,Shares of technology companies fell after an initial bounce following Meta Platforms’ surprisingly strong second-quarter earnings report.,Wall Street Journal,USA,https://www.wsj.com/articles/tech-down-as-meta-bounce-fades-tech-roundup-123de75c
15/08/2023,"Zapata AI, IonQ to Expand Collaboration on Generative AI Techniques",Software company Zapata AI has entered into a strategic alliance with quantum computer manufacturer IonQ.,Wall Street Journal,USA,https://www.wsj.com/articles/zapata-ai-ionq-to-expand-collaboration-on-generative-ai-techniques-c432c09
29/08/2023,Iris Energy Shares Rise 20% After Purchase of AI Hardware,Iris Energy shares were up 20% to $5.16 after the company bought some of Nvidia’s latest-generation artificial intelligence H100 GPUs.,Wall Street Journal,USA,https://www.wsj.com/articles/iris-energy-shares-rise-20-after-purchase-of-ai-hardware-66c0d74f
29/08/2023,Six Flags Partners With Google to Roll Out AI Products,Theme-park operator Six Flags is partnering with Google Cloud to work on generative artificial intelligence and roll out new AI-powered offerings.,Wall Street Journal,USA,https://www.wsj.com/articles/six-flags-partners-with-google-to-roll-out-ai-products-717954a
24/07/2023,"Cognizant, Gilead Extend Service Agreement Worth $800M",Cognizant Technology Solutions said Monday it would continue to manage Gilead Sciences’ global information technology infrastructure for five years in a deal worth up to $800 million.,Wall Street Journal,USA,https://www.wsj.com/articles/cognizant-gilead-extend-service-agreement-worth-800m-74d22b0e
08/03/2023,ChatGPT and Cyber Risk,ChatGPT is a new artificial intelligence-driven technology with capabilities that can potentially aid attackers.,Wall Street Journal,USA,https://www.wsj.com/articles/chatgpt-and-cyber-risk-50b91b22
24/03/2023,ChatGPT and Possible Cyber Benefits,"ChatGPT is currently being used as a time-saving device, but the technology may hold potential for automating more complex tasks.",Wall Street Journal,USA,https://www.wsj.com/articles/chatgpt-and-possible-cyber-benefits-4cbc2d39
16/08/2023,OpenAI Buys Global Illumination to Bolster Core Products,"OpenAI, the startup behind ChatGPT, has bought Global Illumination, whose team has joined OpenAI and will work on core products including ChatGPT.",Wall Street Journal,USA,https://www.wsj.com/articles/openai-buys-global-illumination-to-bolster-core-products-c92c6fe1
01/09/2023,SAP Names Microsoft's Walter Sun as Head of Artificial Intelligence -- Update,"SAP appointed Microsoft’s Walter Sun as global head of artificial intelligence, a move that underscores the business-software company’s efforts to secure a larger share in this fast-growing market.",Wall Street Journal,USA,https://www.wsj.com/articles/sap-names-microsoft-s-walter-sun-as-head-of-artificial-intelligence-update-c23945ef
